{
  "name": "Freesound Sampler",
  "slug": "freesound-sampler",
  "author": "Federico Pepe",
  "authorUrl": "https://github.com/federico-pepe",
  "homepageUrl": "https://github.com/federico-pepe/ableton-live-extensions/tree/main/extensions/freesound-sampler",
  "downloadUrl": "https://raw.githubusercontent.com/federico-pepe/ableton-live-extensions/main/download/Freesound-Sampler-1.1.3.ablx",
  "description": "Searches Freesound.org and downloads sounds directly into your tracks, with OAuth login and an 'Inspire Me' button. Current version 1.1.3; requires Ableton Live Suite 12.4.5 beta.",
  "categories": [
    "integration",
    "audio-tools"
  ],
  "license": "MIT",
  "price": "free",
  "lastUpdated": "2026-06-15",
  "confidence": "verified"
}
