{
  "name": "Bird Game",
  "slug": "bird-game",
  "author": "Federico Pepe",
  "authorUrl": "https://github.com/federico-pepe",
  "homepageUrl": "https://github.com/federico-pepe/ableton-live-extensions/tree/main/extensions/bird-game",
  "downloadUrl": "https://raw.githubusercontent.com/federico-pepe/ableton-live-extensions/main/download/bird-game-1.1.0.ablx",
  "description": "A Flappy Bird-inspired game that runs inside Ableton Live and converts each play run into a MIDI clip; works on macOS and Windows. Current version 1.1.0; requires Ableton Live Suite 12.4.5 beta.",
  "categories": [
    "fun",
    "generative"
  ],
  "license": "MIT",
  "price": "free",
  "confidence": "verified"
}
