{
  "name": "Duplicate Track",
  "slug": "duplicate-track",
  "author": "Federico Pepe",
  "authorUrl": "https://github.com/federico-pepe",
  "homepageUrl": "https://github.com/federico-pepe/ableton-live-extensions/tree/main/extensions/duplicate-track",
  "downloadUrl": "https://raw.githubusercontent.com/federico-pepe/ableton-live-extensions/main/download/Duplicate-Track-0.0.7.ablx",
  "description": "Duplicates a track without copying its clips. Current version 0.0.7; requires Ableton Live Suite 12.4.5 beta.",
  "categories": [
    "workflow",
    "utilities"
  ],
  "license": "MIT",
  "price": "free",
  "confidence": "verified"
}
